2304, 53070, 6050, 12300, 12300, 6050, 2, 1, orange, potato_chips, corn, onion, onion 
2304, 30880, 53070, 18450, 18450, 30880, 2, 0, orange, crackers, potato_chips, cereal, cereal 
2304, 2087, 42488, 6050, 2087, 6050, 0, 2, orange, apple, orange_juice, corn, apple 
2087, 30880, 14073, 53070, 53070, 14073, 2, 1, apple, crackers, coke, potato_chips, potato_chips 
30880, 2304, 5408, 42488, 5408, 2304, 1, 0, crackers, orange, bread, orange_juice, bread 
18450, 30880, 14073, 2304, 30880, 2304, 0, 2, cereal, crackers, coke, orange, crackers 
42488, 14073, 97763, 18450, 97763, 18450, 1, 2, orange_juice, coke, grape_juice, cereal, grape_juice 
14073, 30880, 14073, 53070, 14073, 14073, 1, 1, coke, crackers, coke, potato_chips, coke 
17059, 18450, 97763, 30880, 97763, 18450, 1, 0, jelly, cereal, grape_juice, crackers, grape_juice 
12300, 97763, 17059, 18450, 18450, 18450, 2, 2, onion, grape_juice, jelly, cereal, cereal 
42488, 42488, 17059, 5408, 42488, 42488, 0, 0, orange_juice, orange_juice, jelly, bread, orange_juice 
14073, 97763, 17059, 18450, 97763, 18450, 0, 2, coke, grape_juice, jelly, cereal, grape_juice 
17059, 2087, 18450, 17059, 17059, 17059, 2, 2, jelly, apple, cereal, jelly, jelly 
97763, 14073, 6050, 5408, 14073, 5408, 0, 2, grape_juice, coke, corn, bread, coke 
14073, 97763, 2087, 18450, 97763, 2087, 0, 1, coke, grape_juice, apple, cereal, grape_juice 
12300, 97763, 2304, 5408, 2304, 2304, 1, 1, onion, grape_juice, orange, bread, orange 
14073, 17059, 6050, 18450, 17059, 6050, 0, 1, coke, jelly, corn, cereal, jelly 
2304, 5408, 42488, 2087, 2087, 5408, 2, 0, orange, bread, orange_juice, apple, apple 
5408, 17059, 5408, 6050, 5408, 5408, 1, 1, bread, jelly, bread, corn, bread 
17059, 97763, 5408, 30880, 5408, 5408, 1, 1, jelly, grape_juice, bread, crackers, bread 
18450, 12300, 42488, 6050, 42488, 6050, 1, 2, cereal, onion, orange_juice, corn, orange_juice 
17059, 30880, 53070, 18450, 30880, 18450, 0, 2, jelly, crackers, potato_chips, cereal, crackers 
14073, 2304, 2087, 12300, 2304, 2304, 0, 0, coke, orange, apple, onion, orange 
18450, 5408, 2304, 53070, 2304, 2304, 1, 1, cereal, bread, orange, potato_chips, orange 
53070, 2304, 18450, 97763, 18450, 2304, 1, 0, potato_chips, orange, cereal, grape_juice, cereal 
5408, 18450, 5408, 2087, 5408, 5408, 1, 1, bread, cereal, bread, apple, bread 
17059, 12300, 2304, 18450, 12300, 2304, 0, 1, jelly, onion, orange, cereal, onion 
12300, 18450, 42488, 12300, 12300, 12300, 2, 2, onion, cereal, orange_juice, onion, onion 
6050, 12300, 2304, 14073, 2304, 2304, 1, 1, corn, onion, orange, coke, orange 
6050, 42488, 18450, 14073, 18450, 14073, 1, 2, corn, orange_juice, cereal, coke, cereal 
42488, 5408, 17059, 2087, 17059, 5408, 1, 0, orange_juice, bread, jelly, apple, jelly 
53070, 18450, 42488, 17059, 18450, 18450, 0, 0, potato_chips, cereal, orange_juice, jelly, cereal 
6050, 53070, 97763, 2304, 2304, 2304, 2, 2, corn, potato_chips, grape_juice, orange, orange 
6050, 2087, 53070, 97763, 2087, 2087, 0, 0, corn, apple, potato_chips, grape_juice, apple 
42488, 30880, 6050, 17059, 17059, 6050, 2, 1, orange_juice, crackers, corn, jelly, jelly 
2304, 18450, 30880, 5408, 18450, 5408, 0, 2, orange, cereal, crackers, bread, cereal 
18450, 14073, 18450, 12300, 18450, 18450, 1, 1, cereal, coke, cereal, onion, cereal 
97763, 5408, 42488, 2087, 42488, 5408, 1, 0, grape_juice, bread, orange_juice, apple, orange_juice 
14073, 97763, 17059, 12300, 97763, 12300, 0, 2, coke, grape_juice, jelly, onion, grape_juice 
2304, 2087, 18450, 17059, 2087, 2087, 0, 0, orange, apple, cereal, jelly, apple 
12300, 2087, 12300, 6050, 12300, 12300, 1, 1, onion, apple, onion, corn, onion 
6050, 30880, 14073, 53070, 53070, 14073, 2, 1, corn, crackers, coke, potato_chips, potato_chips 
97763, 30880, 97763, 53070, 97763, 97763, 1, 1, grape_juice, crackers, grape_juice, potato_chips, grape_juice 
12300, 14073, 2087, 2304, 2304, 2304, 2, 2, onion, coke, apple, orange, orange 
5408, 42488, 53070, 2304, 53070, 2304, 1, 2, bread, orange_juice, potato_chips, orange, potato_chips 
2087, 18450, 30880, 5408, 18450, 5408, 0, 2, apple, cereal, crackers, bread, cereal 
30880, 5408, 18450, 42488, 5408, 18450, 0, 1, crackers, bread, cereal, orange_juice, bread 
6050, 12300, 97763, 42488, 97763, 12300, 1, 0, corn, onion, grape_juice, orange_juice, grape_juice 
30880, 42488, 53070, 17059, 53070, 17059, 1, 2, crackers, orange_juice, potato_chips, jelly, potato_chips 
6050, 12300, 2087, 42488, 42488, 2087, 2, 1, corn, onion, apple, orange_juice, orange_juice 
30880, 97763, 5408, 14073, 5408, 5408, 1, 1, crackers, grape_juice, bread, coke, bread 
17059, 14073, 6050, 97763, 97763, 6050, 2, 1, jelly, coke, corn, grape_juice, grape_juice 
30880, 12300, 2304, 14073, 14073, 2304, 2, 1, crackers, onion, orange, coke, coke 
30880, 30880, 2304, 97763, 30880, 30880, 0, 0, crackers, crackers, orange, grape_juice, crackers 
97763, 30880, 53070, 5408, 53070, 5408, 1, 2, grape_juice, crackers, potato_chips, bread, potato_chips 
42488, 2087, 14073, 97763, 97763, 2087, 2, 0, orange_juice, apple, coke, grape_juice, grape_juice 
30880, 53070, 17059, 5408, 5408, 5408, 2, 2, crackers, potato_chips, jelly, bread, bread 
2304, 18450, 97763, 30880, 97763, 30880, 1, 2, orange, cereal, grape_juice, crackers, grape_juice 
97763, 12300, 53070, 17059, 17059, 17059, 2, 2, grape_juice, onion, potato_chips, jelly, jelly 
6050, 97763, 17059, 12300, 12300, 12300, 2, 2, corn, grape_juice, jelly, onion, onion 
5408, 14073, 12300, 5408, 5408, 5408, 2, 2, bread, coke, onion, bread, bread 
5408, 12300, 5408, 30880, 5408, 5408, 1, 1, bread, onion, bread, crackers, bread 
5408, 14073, 18450, 12300, 18450, 12300, 1, 2, bread, coke, cereal, onion, cereal 
12300, 97763, 42488, 6050, 6050, 6050, 2, 2, onion, grape_juice, orange_juice, corn, corn 
42488, 18450, 30880, 5408, 5408, 5408, 2, 2, orange_juice, cereal, crackers, bread, bread 
53070, 30880, 2304, 97763, 30880, 2304, 0, 1, potato_chips, crackers, orange, grape_juice, crackers 
14073, 2087, 18450, 6050, 18450, 6050, 1, 2, coke, apple, cereal, corn, cereal 
14073, 5408, 2304, 17059, 5408, 2304, 0, 1, coke, bread, orange, jelly, bread 
6050, 18450, 30880, 6050, 6050, 6050, 2, 2, corn, cereal, crackers, corn, corn 
2304, 6050, 18450, 42488, 42488, 6050, 2, 0, orange, corn, cereal, orange_juice, orange_juice 
2087, 5408, 14073, 17059, 17059, 5408, 2, 0, apple, bread, coke, jelly, jelly 
30880, 53070, 97763, 5408, 5408, 5408, 2, 2, crackers, potato_chips, grape_juice, bread, bread 
97763, 2304, 30880, 53070, 30880, 2304, 1, 0, grape_juice, orange, crackers, potato_chips, crackers 
2304, 6050, 2304, 17059, 2304, 2304, 1, 1, orange, corn, orange, jelly, orange 
2304, 12300, 5408, 97763, 12300, 5408, 0, 1, orange, onion, bread, grape_juice, onion 
17059, 97763, 18450, 6050, 18450, 6050, 1, 2, jelly, grape_juice, cereal, corn, cereal 
97763, 12300, 2304, 14073, 2304, 2304, 1, 1, grape_juice, onion, orange, coke, orange 
97763, 2087, 12300, 6050, 2087, 2087, 0, 0, grape_juice, apple, onion, corn, apple 
14073, 14073, 5408, 2087, 14073, 14073, 0, 0, coke, coke, bread, apple, coke 
53070, 5408, 42488, 2087, 5408, 2087, 0, 2, potato_chips, bread, orange_juice, apple, bread 
18450, 18450, 2304, 2087, 18450, 18450, 0, 0, cereal, cereal, orange, apple, cereal 
30880, 17059, 53070, 2087, 53070, 2087, 1, 2, crackers, jelly, potato_chips, apple, potato_chips 
2087, 18450, 12300, 53070, 12300, 18450, 1, 0, apple, cereal, onion, potato_chips, onion 
97763, 18450, 12300, 2087, 2087, 2087, 2, 2, grape_juice, cereal, onion, apple, apple 
18450, 53070, 17059, 5408, 5408, 17059, 2, 1, cereal, potato_chips, jelly, bread, bread 
2087, 12300, 6050, 30880, 12300, 6050, 0, 1, apple, onion, corn, crackers, onion 
14073, 97763, 2304, 5408, 97763, 2304, 0, 1, coke, grape_juice, orange, bread, grape_juice 
14073, 14073, 6050, 97763, 14073, 14073, 0, 0, coke, coke, corn, grape_juice, coke 
2087, 97763, 17059, 14073, 17059, 14073, 1, 2, apple, grape_juice, jelly, coke, jelly 
2087, 18450, 12300, 53070, 12300, 18450, 1, 0, apple, cereal, onion, potato_chips, onion 
30880, 5408, 2304, 30880, 30880, 30880, 2, 2, crackers, bread, orange, crackers, crackers 
53070, 6050, 2304, 97763, 2304, 2304, 1, 1, potato_chips, corn, orange, grape_juice, orange 
18450, 42488, 2304, 17059, 42488, 2304, 0, 1, cereal, orange_juice, orange, jelly, orange_juice 
6050, 17059, 2304, 12300, 12300, 2304, 2, 1, corn, jelly, orange, onion, onion 
30880, 2087, 42488, 30880, 30880, 30880, 2, 2, crackers, apple, orange_juice, crackers, crackers 
5408, 2087, 12300, 6050, 6050, 6050, 2, 2, bread, apple, onion, corn, corn 
17059, 17059, 2087, 12300, 17059, 17059, 0, 0, jelly, jelly, apple, onion, jelly 
18450, 2087, 6050, 14073, 2087, 6050, 0, 1, cereal, apple, corn, coke, apple 
97763, 97763, 5408, 14073, 97763, 97763, 0, 0, grape_juice, grape_juice, bread, coke, grape_juice 
14073, 14073, 6050, 2304, 14073, 14073, 0, 0, coke, coke, corn, orange, coke 
14073, 6050, 30880, 2304, 2304, 6050, 2, 0, coke, corn, crackers, orange, orange 
30880, 14073, 53070, 12300, 53070, 14073, 1, 0, crackers, coke, potato_chips, onion, potato_chips 
17059, 97763, 14073, 2304, 97763, 2304, 0, 2, jelly, grape_juice, coke, orange, grape_juice 
14073, 12300, 5408, 97763, 97763, 5408, 2, 1, coke, onion, bread, grape_juice, grape_juice 
42488, 30880, 2304, 97763, 97763, 2304, 2, 1, orange_juice, crackers, orange, grape_juice, grape_juice 
42488, 5408, 42488, 2087, 42488, 42488, 1, 1, orange_juice, bread, orange_juice, apple, orange_juice 
2304, 42488, 2304, 17059, 2304, 2304, 1, 1, orange, orange_juice, orange, jelly, orange 
17059, 14073, 30880, 5408, 14073, 5408, 0, 2, jelly, coke, crackers, bread, coke 
2087, 97763, 42488, 53070, 42488, 42488, 1, 1, apple, grape_juice, orange_juice, potato_chips, orange_juice 
18450, 97763, 17059, 12300, 17059, 17059, 1, 1, cereal, grape_juice, jelly, onion, jelly 
18450, 18450, 12300, 53070, 18450, 18450, 0, 0, cereal, cereal, onion, potato_chips, cereal 
97763, 18450, 30880, 12300, 18450, 18450, 0, 0, grape_juice, cereal, crackers, onion, cereal 
18450, 30880, 18450, 2087, 18450, 18450, 1, 1, cereal, crackers, cereal, apple, cereal 
14073, 53070, 6050, 12300, 12300, 6050, 2, 1, coke, potato_chips, corn, onion, onion 
5408, 2304, 53070, 2087, 53070, 2304, 1, 0, bread, orange, potato_chips, apple, potato_chips 
2087, 53070, 17059, 5408, 17059, 5408, 1, 2, apple, potato_chips, jelly, bread, jelly 
6050, 14073, 5408, 2087, 2087, 5408, 2, 1, corn, coke, bread, apple, apple 
17059, 12300, 6050, 30880, 30880, 6050, 2, 1, jelly, onion, corn, crackers, crackers 
53070, 17059, 14073, 18450, 18450, 14073, 2, 1, potato_chips, jelly, coke, cereal, cereal 
2304, 17059, 2304, 12300, 2304, 2304, 1, 1, orange, jelly, orange, onion, orange 
53070, 42488, 53070, 30880, 53070, 53070, 1, 1, potato_chips, orange_juice, potato_chips, crackers, potato_chips 
17059, 53070, 97763, 12300, 97763, 12300, 1, 2, jelly, potato_chips, grape_juice, onion, grape_juice 
42488, 2087, 53070, 42488, 42488, 42488, 2, 2, orange_juice, apple, potato_chips, orange_juice, orange_juice 
18450, 5408, 12300, 53070, 5408, 5408, 0, 0, cereal, bread, onion, potato_chips, bread 
2304, 2087, 18450, 17059, 2087, 2087, 0, 0, orange, apple, cereal, jelly, apple 
2087, 12300, 2087, 42488, 2087, 2087, 1, 1, apple, onion, apple, orange_juice, apple 
5408, 30880, 42488, 17059, 17059, 17059, 2, 2, bread, crackers, orange_juice, jelly, jelly 
18450, 5408, 12300, 53070, 12300, 5408, 1, 0, cereal, bread, onion, potato_chips, onion 
2304, 97763, 2304, 5408, 2304, 2304, 1, 1, orange, grape_juice, orange, bread, orange 
2304, 12300, 5408, 97763, 12300, 5408, 0, 1, orange, onion, bread, grape_juice, onion 
53070, 97763, 42488, 53070, 53070, 53070, 2, 2, potato_chips, grape_juice, orange_juice, potato_chips, potato_chips 
42488, 2087, 6050, 5408, 2087, 6050, 0, 1, orange_juice, apple, corn, bread, apple 
18450, 97763, 2304, 42488, 2304, 2304, 1, 1, cereal, grape_juice, orange, orange_juice, orange 
42488, 18450, 30880, 12300, 18450, 18450, 0, 0, orange_juice, cereal, crackers, onion, cereal 
18450, 42488, 2304, 17059, 42488, 2304, 0, 1, cereal, orange_juice, orange, jelly, orange_juice 
30880, 2087, 18450, 14073, 14073, 18450, 2, 1, crackers, apple, cereal, coke, coke 
2087, 42488, 2304, 30880, 2304, 2304, 1, 1, apple, orange_juice, orange, crackers, orange 
97763, 5408, 6050, 53070, 6050, 5408, 1, 0, grape_juice, bread, corn, potato_chips, corn 
5408, 14073, 6050, 2304, 6050, 2304, 1, 2, bread, coke, corn, orange, corn 
12300, 12300, 2087, 14073, 12300, 12300, 0, 0, onion, onion, apple, coke, onion 
18450, 18450, 14073, 5408, 18450, 18450, 0, 0, cereal, cereal, coke, bread, cereal 
42488, 18450, 2304, 30880, 2304, 2304, 1, 1, orange_juice, cereal, orange, crackers, orange 
17059, 18450, 42488, 17059, 17059, 17059, 2, 2, jelly, cereal, orange_juice, jelly, jelly 
2304, 14073, 30880, 5408, 5408, 5408, 2, 2, orange, coke, crackers, bread, bread 
6050, 5408, 14073, 17059, 5408, 5408, 0, 0, corn, bread, coke, jelly, bread 
12300, 30880, 2304, 97763, 2304, 2304, 1, 1, onion, crackers, orange, grape_juice, orange 
5408, 97763, 2087, 42488, 2087, 2087, 1, 1, bread, grape_juice, apple, orange_juice, apple 
18450, 6050, 2304, 17059, 17059, 6050, 2, 0, cereal, corn, orange, jelly, jelly 
42488, 2087, 53070, 42488, 42488, 42488, 2, 2, orange_juice, apple, potato_chips, orange_juice, orange_juice 
42488, 2087, 30880, 14073, 14073, 2087, 2, 0, orange_juice, apple, crackers, coke, coke 
17059, 2304, 5408, 12300, 5408, 2304, 1, 0, jelly, orange, bread, onion, bread 
97763, 42488, 18450, 2304, 42488, 2304, 0, 2, grape_juice, orange_juice, cereal, orange, orange_juice 
5408, 14073, 42488, 6050, 6050, 6050, 2, 2, bread, coke, orange_juice, corn, corn 
5408, 30880, 42488, 17059, 17059, 17059, 2, 2, bread, crackers, orange_juice, jelly, jelly 
18450, 97763, 42488, 53070, 53070, 42488, 2, 1, cereal, grape_juice, orange_juice, potato_chips, potato_chips 
14073, 18450, 97763, 30880, 97763, 18450, 1, 0, coke, cereal, grape_juice, crackers, grape_juice 
5408, 42488, 97763, 14073, 42488, 14073, 0, 2, bread, orange_juice, grape_juice, coke, orange_juice 
6050, 2087, 42488, 6050, 6050, 6050, 2, 2, corn, apple, orange_juice, corn, corn 
12300, 42488, 53070, 18450, 53070, 18450, 1, 2, onion, orange_juice, potato_chips, cereal, potato_chips 
12300, 2304, 5408, 42488, 2304, 2304, 0, 0, onion, orange, bread, orange_juice, orange 
14073, 30880, 12300, 42488, 42488, 12300, 2, 1, coke, crackers, onion, orange_juice, orange_juice 
97763, 17059, 14073, 30880, 14073, 14073, 1, 1, grape_juice, jelly, coke, crackers, coke 
97763, 5408, 2304, 17059, 17059, 5408, 2, 0, grape_juice, bread, orange, jelly, jelly 
30880, 97763, 2304, 42488, 42488, 2304, 2, 1, crackers, grape_juice, orange, orange_juice, orange_juice 
6050, 42488, 53070, 18450, 18450, 18450, 2, 2, corn, orange_juice, potato_chips, cereal, cereal 
97763, 30880, 14073, 53070, 14073, 14073, 1, 1, grape_juice, crackers, coke, potato_chips, coke 
17059, 42488, 18450, 14073, 42488, 18450, 0, 1, jelly, orange_juice, cereal, coke, orange_juice 
53070, 17059, 2304, 12300, 17059, 2304, 0, 1, potato_chips, jelly, orange, onion, jelly 
2087, 6050, 2304, 97763, 2304, 2304, 1, 1, apple, corn, orange, grape_juice, orange 
2087, 30880, 14073, 53070, 30880, 14073, 0, 1, apple, crackers, coke, potato_chips, crackers 
97763, 30880, 53070, 5408, 30880, 5408, 0, 2, grape_juice, crackers, potato_chips, bread, crackers 
17059, 30880, 53070, 2087, 2087, 2087, 2, 2, jelly, crackers, potato_chips, apple, apple 
5408, 14073, 5408, 53070, 5408, 5408, 1, 1, bread, coke, bread, potato_chips, bread 
14073, 2087, 42488, 6050, 2087, 6050, 0, 2, coke, apple, orange_juice, corn, apple 
2087, 30880, 2304, 17059, 2304, 2304, 1, 1, apple, crackers, orange, jelly, orange 
18450, 97763, 17059, 12300, 17059, 17059, 1, 1, cereal, grape_juice, jelly, onion, jelly 
14073, 14073, 53070, 97763, 14073, 14073, 0, 0, coke, coke, potato_chips, grape_juice, coke 
18450, 6050, 2087, 17059, 6050, 6050, 0, 0, cereal, corn, apple, jelly, corn 
12300, 17059, 6050, 53070, 6050, 6050, 1, 1, onion, jelly, corn, potato_chips, corn 
2087, 42488, 6050, 5408, 6050, 6050, 1, 1, apple, orange_juice, corn, bread, corn 
53070, 97763, 2304, 42488, 42488, 2304, 2, 1, potato_chips, grape_juice, orange, orange_juice, orange_juice 
5408, 30880, 2304, 17059, 30880, 2304, 0, 1, bread, crackers, orange, jelly, crackers 
18450, 14073, 30880, 5408, 30880, 30880, 1, 1, cereal, coke, crackers, bread, crackers 
42488, 30880, 12300, 53070, 30880, 12300, 0, 1, orange_juice, crackers, onion, potato_chips, crackers 
2304, 5408, 2087, 30880, 2087, 5408, 1, 0, orange, bread, apple, crackers, apple 
17059, 17059, 5408, 18450, 17059, 17059, 0, 0, jelly, jelly, bread, cereal, jelly 
2304, 42488, 30880, 6050, 42488, 6050, 0, 2, orange, orange_juice, crackers, corn, orange_juice 
53070, 18450, 12300, 97763, 18450, 12300, 0, 1, potato_chips, cereal, onion, grape_juice, cereal 
6050, 2087, 17059, 14073, 2087, 2087, 0, 0, corn, apple, jelly, coke, apple 
2304, 18450, 30880, 5408, 5408, 5408, 2, 2, orange, cereal, crackers, bread, bread 
2304, 2087, 12300, 30880, 2087, 2087, 0, 0, orange, apple, onion, crackers, apple 
17059, 97763, 14073, 12300, 97763, 14073, 0, 1, jelly, grape_juice, coke, onion, grape_juice 
2304, 30880, 6050, 17059, 30880, 6050, 0, 1, orange, crackers, corn, jelly, crackers 
2087, 12300, 53070, 17059, 12300, 12300, 0, 0, apple, onion, potato_chips, jelly, onion 
97763, 12300, 2087, 14073, 14073, 2087, 2, 1, grape_juice, onion, apple, coke, coke 
17059, 12300, 17059, 6050, 17059, 17059, 1, 1, jelly, onion, jelly, corn, jelly 
30880, 14073, 53070, 2304, 53070, 2304, 1, 2, crackers, coke, potato_chips, orange, potato_chips 
42488, 97763, 42488, 5408, 42488, 42488, 1, 1, orange_juice, grape_juice, orange_juice, bread, orange_juice 
2304, 17059, 42488, 12300, 42488, 12300, 1, 2, orange, jelly, orange_juice, onion, orange_juice 
97763, 2087, 53070, 42488, 2087, 2087, 0, 0, grape_juice, apple, potato_chips, orange_juice, apple 
2304, 17059, 53070, 2087, 2087, 2087, 2, 2, orange, jelly, potato_chips, apple, apple 
18450, 97763, 2304, 2087, 97763, 2304, 0, 1, cereal, grape_juice, orange, apple, grape_juice 
5408, 97763, 18450, 53070, 18450, 18450, 1, 1, bread, grape_juice, cereal, potato_chips, cereal 
42488, 18450, 5408, 6050, 18450, 6050, 0, 2, orange_juice, cereal, bread, corn, cereal 
97763, 30880, 53070, 5408, 30880, 5408, 0, 2, grape_juice, crackers, potato_chips, bread, crackers 
12300, 17059, 42488, 2087, 2087, 2087, 2, 2, onion, jelly, orange_juice, apple, apple 
12300, 42488, 53070, 18450, 42488, 18450, 0, 2, onion, orange_juice, potato_chips, cereal, orange_juice 
18450, 6050, 18450, 42488, 18450, 18450, 1, 1, cereal, corn, cereal, orange_juice, cereal 
30880, 18450, 53070, 14073, 18450, 18450, 0, 0, crackers, cereal, potato_chips, coke, cereal 
42488, 14073, 97763, 30880, 97763, 14073, 1, 0, orange_juice, coke, grape_juice, crackers, grape_juice 
5408, 17059, 2087, 12300, 17059, 12300, 0, 2, bread, jelly, apple, onion, jelly 
42488, 14073, 5408, 2087, 5408, 5408, 1, 1, orange_juice, coke, bread, apple, bread 
2304, 2087, 17059, 2304, 2304, 2304, 2, 2, orange, apple, jelly, orange, orange 
18450, 17059, 12300, 18450, 18450, 18450, 2, 2, cereal, jelly, onion, cereal, cereal 
14073, 2087, 17059, 2304, 17059, 2304, 1, 2, coke, apple, jelly, orange, jelly 
6050, 53070, 97763, 17059, 17059, 17059, 2, 2, corn, potato_chips, grape_juice, jelly, jelly 
53070, 6050, 30880, 53070, 53070, 53070, 2, 2, potato_chips, corn, crackers, potato_chips, potato_chips 
18450, 12300, 2304, 6050, 12300, 6050, 0, 2, cereal, onion, orange, corn, onion 
18450, 14073, 53070, 97763, 53070, 14073, 1, 0, cereal, coke, potato_chips, grape_juice, potato_chips 
97763, 18450, 14073, 2304, 14073, 2304, 1, 2, grape_juice, cereal, coke, orange, coke 
18450, 12300, 2087, 53070, 53070, 2087, 2, 1, cereal, onion, apple, potato_chips, potato_chips 
14073, 12300, 14073, 17059, 14073, 14073, 1, 1, coke, onion, coke, jelly, coke 
6050, 30880, 12300, 42488, 12300, 12300, 1, 1, corn, crackers, onion, orange_juice, onion 
2087, 2087, 97763, 12300, 2087, 2087, 0, 0, apple, apple, grape_juice, onion, apple 
42488, 18450, 30880, 6050, 18450, 6050, 0, 2, orange_juice, cereal, crackers, corn, cereal 
53070, 17059, 14073, 18450, 18450, 14073, 2, 1, potato_chips, jelly, coke, cereal, cereal 
6050, 18450, 14073, 2304, 18450, 2304, 0, 2, corn, cereal, coke, orange, cereal 
53070, 42488, 53070, 5408, 53070, 53070, 1, 1, potato_chips, orange_juice, potato_chips, bread, potato_chips 
18450, 2087, 18450, 6050, 18450, 18450, 1, 1, cereal, apple, cereal, corn, cereal 
6050, 17059, 5408, 30880, 5408, 5408, 1, 1, corn, jelly, bread, crackers, bread 
18450, 97763, 17059, 12300, 12300, 17059, 2, 1, cereal, grape_juice, jelly, onion, onion 
12300, 18450, 12300, 53070, 12300, 12300, 1, 1, onion, cereal, onion, potato_chips, onion 
30880, 30880, 53070, 18450, 30880, 30880, 0, 0, crackers, crackers, potato_chips, cereal, crackers 
42488, 30880, 53070, 18450, 53070, 18450, 1, 2, orange_juice, crackers, potato_chips, cereal, potato_chips 
2087, 30880, 2087, 6050, 2087, 2087, 1, 1, apple, crackers, apple, corn, apple 
5408, 97763, 2087, 42488, 97763, 2087, 0, 1, bread, grape_juice, apple, orange_juice, grape_juice 
12300, 14073, 42488, 2304, 2304, 2304, 2, 2, onion, coke, orange_juice, orange, orange 
30880, 5408, 14073, 17059, 5408, 5408, 0, 0, crackers, bread, coke, jelly, bread 
18450, 97763, 5408, 14073, 5408, 5408, 1, 1, cereal, grape_juice, bread, coke, bread 
30880, 18450, 30880, 12300, 30880, 30880, 1, 1, crackers, cereal, crackers, onion, crackers 
2087, 2304, 2087, 12300, 2087, 2087, 1, 1, apple, orange, apple, onion, apple 
18450, 2087, 5408, 53070, 5408, 2087, 1, 0, cereal, apple, bread, potato_chips, bread 
97763, 30880, 12300, 42488, 30880, 42488, 0, 2, grape_juice, crackers, onion, orange_juice, crackers 
18450, 97763, 2304, 2087, 2087, 2304, 2, 1, cereal, grape_juice, orange, apple, apple 
53070, 97763, 42488, 5408, 5408, 5408, 2, 2, potato_chips, grape_juice, orange_juice, bread, bread 
12300, 97763, 17059, 18450, 18450, 18450, 2, 2, onion, grape_juice, jelly, cereal, cereal 
12300, 18450, 2304, 2087, 2087, 2304, 2, 1, onion, cereal, orange, apple, apple 
30880, 42488, 6050, 5408, 6050, 6050, 1, 1, crackers, orange_juice, corn, bread, corn 
5408, 18450, 2304, 30880, 30880, 2304, 2, 1, bread, cereal, orange, crackers, crackers 
14073, 53070, 6050, 12300, 6050, 6050, 1, 1, coke, potato_chips, corn, onion, corn 
30880, 6050, 2087, 97763, 2087, 6050, 1, 0, crackers, corn, apple, grape_juice, apple 
12300, 97763, 42488, 53070, 53070, 42488, 2, 1, onion, grape_juice, orange_juice, potato_chips, potato_chips 
6050, 30880, 12300, 53070, 12300, 12300, 1, 1, corn, crackers, onion, potato_chips, onion 
17059, 12300, 5408, 30880, 30880, 5408, 2, 1, jelly, onion, bread, crackers, crackers 
30880, 2087, 30880, 14073, 30880, 30880, 1, 1, crackers, apple, crackers, coke, crackers 
30880, 30880, 6050, 17059, 30880, 30880, 0, 0, crackers, crackers, corn, jelly, crackers 
18450, 30880, 53070, 17059, 30880, 30880, 0, 0, cereal, crackers, potato_chips, jelly, crackers 
14073, 5408, 2304, 53070, 53070, 2304, 2, 1, coke, bread, orange, potato_chips, potato_chips 
42488, 42488, 53070, 17059, 42488, 42488, 0, 0, orange_juice, orange_juice, potato_chips, jelly, orange_juice 
30880, 5408, 2304, 30880, 30880, 30880, 2, 2, crackers, bread, orange, crackers, crackers 
14073, 6050, 30880, 53070, 53070, 6050, 2, 0, coke, corn, crackers, potato_chips, potato_chips 
97763, 42488, 53070, 12300, 42488, 42488, 0, 0, grape_juice, orange_juice, potato_chips, onion, orange_juice 
14073, 18450, 2304, 2087, 18450, 2304, 0, 1, coke, cereal, orange, apple, cereal 
5408, 12300, 97763, 42488, 97763, 12300, 1, 0, bread, onion, grape_juice, orange_juice, grape_juice 
18450, 17059, 14073, 18450, 18450, 18450, 2, 2, cereal, jelly, coke, cereal, cereal 
2304, 42488, 2304, 17059, 2304, 2304, 1, 1, orange, orange_juice, orange, jelly, orange 
14073, 14073, 42488, 2304, 14073, 14073, 0, 0, coke, coke, orange_juice, orange, coke 
6050, 2087, 6050, 5408, 6050, 6050, 1, 1, corn, apple, corn, bread, corn 
18450, 42488, 30880, 6050, 30880, 6050, 1, 2, cereal, orange_juice, crackers, corn, crackers 
2304, 5408, 2304, 2087, 2304, 2304, 1, 1, orange, bread, orange, apple, orange 
97763, 97763, 17059, 2087, 97763, 97763, 0, 0, grape_juice, grape_juice, jelly, apple, grape_juice 
18450, 14073, 97763, 30880, 97763, 30880, 1, 2, cereal, coke, grape_juice, crackers, grape_juice 
2087, 2087, 18450, 17059, 2087, 2087, 0, 0, apple, apple, cereal, jelly, apple 
53070, 97763, 5408, 14073, 14073, 14073, 2, 2, potato_chips, grape_juice, bread, coke, coke 
14073, 2304, 18450, 97763, 97763, 2304, 2, 0, coke, orange, cereal, grape_juice, grape_juice 
5408, 14073, 30880, 5408, 5408, 5408, 2, 2, bread, coke, crackers, bread, bread 
2087, 14073, 97763, 30880, 97763, 14073, 1, 0, apple, coke, grape_juice, crackers, grape_juice 
97763, 18450, 42488, 17059, 42488, 18450, 1, 0, grape_juice, cereal, orange_juice, jelly, orange_juice 
2304, 14073, 5408, 2087, 2087, 5408, 2, 1, orange, coke, bread, apple, apple 
2087, 18450, 14073, 2304, 2304, 2304, 2, 2, apple, cereal, coke, orange, orange 
30880, 2087, 42488, 30880, 30880, 30880, 2, 2, crackers, apple, orange_juice, crackers, crackers 
30880, 5408, 18450, 97763, 18450, 18450, 1, 1, crackers, bread, cereal, grape_juice, cereal 
42488, 14073, 2087, 2304, 2304, 2304, 2, 2, orange_juice, coke, apple, orange, orange 
6050, 18450, 12300, 2087, 18450, 2087, 0, 2, corn, cereal, onion, apple, cereal 
6050, 30880, 14073, 53070, 14073, 14073, 1, 1, corn, crackers, coke, potato_chips, coke 
14073, 53070, 97763, 17059, 97763, 17059, 1, 2, coke, potato_chips, grape_juice, jelly, grape_juice 
